Paper ID,Type,Title,github,Author(s)
974,Spotlight,Weakly Supervised Instance Segmentation using Class Peak Response,https://github.com/ZhouYanzhao/PRM,"Yanzhao Zhou, UCAS, China; Yi Zhu, UCAS; Qixiang Ye, ; Qiang Qiu, ; Jianbin Jiao,"
801,Spotlight,Unsupervised Feature Learning via Non-Parametric Instance-level Discrimination,https://github.com/zhirongw/lemniscate.pytorch,"Zhirong Wu, UC Berkeley; Yuanjun Xiong, Amazon ; Stella Yu, UC Berkeley / ICSI; Dahua Lin, CUHK"
2603,Spotlight,Cascade R-CNN: Delving into High Quality Object Detection,https://github.com/zhaoweicai/cascade-rcnn,"Zhaowei Cai, UC San Diego; Nuno Vasconcelos, UCSD, USA"
3662,Oral,StarGAN: Unified Generative Adversarial Networks for Controllable Multi-Domain Image-to-Image Translation,https://github.com/yunjey/StarGAN,"Jaegul Choo, Korea University; Jung-Woo Ha, NAVER Corp; Munyoung Kim, The College of New Jersey; Yunjey Choi, Korea University; Minje Choi, Korea University; Sunghun Kim, HKUST"
847,Poster,End-to-End Deep Kronecker-Product Matching for Person Re-identification,https://github.com/YantaoShen/kpm_rw_person_reid,"Yantao Shen, CUHK; Tong Xiao, The Chinese University of HK; Hongsheng Li, ; Shuai Yi, The Chinese University of Hong Kong; Xiaogang Wang, Chinese University of Hong Kong"
874,Poster,Deep Group-shuffling Random Walk for Person Re-identification,https://github.com/YantaoShen/kpm_rw_person_reid,"Yantao Shen, CUHK; Hongsheng Li, ; Tong Xiao, The Chinese University of HK; Shuai Yi, The Chinese University of Hong Kong; Dapeng Chen, CUHK; Xiaogang Wang, Chinese University of Hong Kong"
1330,Poster,Look at Boundary: A Boundary-Aware Face Alignment Algorithm,https://github.com/wywu/LAB,"Wayne Wu, SenseTime; Chen Qian, SenseTime; Shuo Yang, ; Quan Wang, SenseTime"
3524,Spotlight,Rethinking Feature Distribution for Loss Functions in Image Classification,https://github.com/WeitaoVan/L-GM-loss,"Weitao Wan, Tsinghua University; Yuanyi Zhong, UIUC; Tianpeng Li, Tsinghua University; Jiansheng Chen, Tsinghua University"
1532,Oral,Detail-Preserving Pooling in Deep Networks,https://github.com/visinf/dpp,"Faraz Saeedan, TU Darmstadt; Nicolas Weber, ; Michael Goesele, TU Darmstadt; Stefan Roth,"
136,Spotlight,LiteFlowNet: A Lightweight Convolutional Neural Network for Optical Flow Estimation,https://github.com/twhui/LiteFlowNet,"Tak-Wai Hui, The Chinese University of Hong Kong; Chen-Change Loy, the Chinese University of Hong Kong; Xiaoou Tang, Chinese University of Hong Kong"
429,Poster,Future Frame Prediction for Anomaly Detection  A New Baseline,https://github.com/StevenLiuWen/ano_pred_cvpr2018,"Wen Liu, ShanghaiTech University; Weixin Luo, Shanghaitech University; Dongze Lian, ShanghaiTech University; Shenghua Gao, ShanghaiTech University"
744,Oral,Taskonomy: Disentangling Task Transfer Learning,https://github.com/StanfordVL/taskonomy,"Alexander Sax, Stanford University; William Shen, ; Amir Zamir, Stanford, UC Berkeley; Jitendra Malik, ; Silvio Savarese, ; Leonidas J. Guibas,"
2541,Poster,Weakly-Supervised Semantic Segmentation Network with Deep Seeded Region Growing,https://github.com/speedinghzl/DSRG,"Zilong Huang, HUST; Xinggang Wang, ; Jiasi Wang, HUST; Wenyu Liu, ; Jingdong Wang, Microsoft Research"
2951,Spotlight,High Performance Visual Tracking with Siamese Region Proposal Network,https://github.com/songdejia/Siamese-RPN-pytorch,"Bo Li, SenseTime ; Wei Wu, ; Zheng Zhu, Institute of Automation, CAS; Junjie Yan,"
2312,Poster,Learning a Discriminative Filter Bank within a CNN for Fine-grained Recognition,https://github.com/songdejia/DFL-CNN,"Yaming Wang, University of Maryland; Vlad Morariu, University of Maryland; Larry Davis, University of Maryland, USA"
948,Poster,Image-Image Domain Adaptation with Preserved Self-Similarity and Domain-Dissimilarity for Person Re-identification,https://github.com/Simon4Yan/Learning-via-Translation,"Weijian Deng, University of Chinese Academy; Liang Zheng, University of Texas at San Ant; GUOLIANG KANG, UTS; Yi Yang, ; Qixiang Ye, ; Jianbin Jiao,"
5,Poster,Single-Shot Refinement Neural Network for Object Detection,https://github.com/sfzhang15/RefineDet,"Shifeng Zhang, CBSR, NLPR, CASIA; Longyin Wen, GE Global Research Center; Xiao Bian, ; Zhen Lei, Chinese Academy of Sciences ; Stan Li,"
1520,Spotlight,Attentive Generative Adversarial Network for Raindrop Removal from A Single Image,https://github.com/rui1996/DeRaindrop,"Rui Qian, Peking University; Robby Tan, Yale-NUS College Also, Electrical and Computer Engineering, NUS; Wenhan Yang, Peking University; Jiajun Su, Peking University; Jiaying Liu, Peking University"
1163,Oral,Bottom-Up and Top-Down Attention for Image Captioning and Visual Question Answering,https://github.com/peteanderson80/bottom-up-attention,"Peter Anderson, Australian National University; Xiaodong He, ; Chris Buehler, ; Damien Teney, Unversity of Adelaide; Mark Johnson, Macquarie University; Stephen Gould, Australian National University; Lei Zhang, Microsoft"
326,Oral,SPLATNet: Sparse Lattice Networks for Point Cloud Processing,https://github.com/NVlabs/splatnet,"Hang Su, University of Massachusetts, Amherst; Varun Jampani, NVIDIA Research; Deqing Sun, NVIDIA; Evangelos Kalogerakis, UMass; Subhransu Maji, ; Ming-Hsuan Yang, UC Merced; Jan Kautz, NVIDIA"
266,Oral,"PWC-Net: CNNs for Optical Flow Using Pyramid, Warping, and Cost Volume",https://github.com/NVlabs/PWC-Net,"Deqing Sun, NVIDIA; Xiaodong Yang, NVIDIA; Ming-Yu Liu, NVIDIA; Jan Kautz, NVIDIA"
168,Spotlight,MapNet: Geometry-Aware Learning of Maps for Camera Localization,https://github.com/NVlabs/geomapnet,"Samarth Brahmbhatt, Georgia Tech; Jinwei Gu, NVIDIA; Kihwan Kim, NVIDIA Research; James Hays, Georgia Tech; Jan Kautz, NVIDIA"
768,Oral,High-Resolution Image Synthesis and Semantic Manipulation with Conditional GANs,https://github.com/NVIDIA/pix2pixHD,"Ting-Chun Wang, NVIDIA; Ming-Yu Liu, NVIDIA; Jun-Yan Zhu, UC Berkeley; Andrew Tao, NVIDIA; Bryan Catanzaro, NVIDIA; Jan Kautz, NVIDIA"
1164,Poster,Cross-Domain Weakly-Supervised Object Detection through Progressive Domain Adaptation,https://github.com/naoto0804/cross-domain-detection,"Naoto Inoue, The University of Tokyo; Ryosuke Furuta, The University of Tokyo; Toshihiko Yamasaki, The University of Tokyo; Kiyoharu Aizawa,"
2496,Spotlight,Mesoscopic Facial Geometry inference Using Deep Neural Networks,https://github.com/msracver/Relation-Networks-for-Object-Detection,"Loc Huynh, USC ICT; Weikai Chen, USC ICT; Shunsuke Saito, ; Jun Xing, ICT; Koki Nagano, Pinscreen, Inc; Andrew Jones, USC ICT; Paul Debevec, USC ICT; Hao Li,"
2548,Poster,V2V-PoseNet: Voxel-to-Voxel Prediction Network for Accurate 3D Hand and Human Pose Estimation from a Single Depth Map,https://github.com/mks0601/V2V-PoseNet_RELEASE,"Gyeongsik Moon, Seoul National University; Ju Yong Chang, Kwangwoon University; Kyoung Mu Lee,"
2201,Poster,SO-Net: Self-Organizing Network for Point Cloud Analysis,https://github.com/lijx10/SO-Net,"Jiaxin Li, National University of Singapore; Ben Chen, National Univ of Singapore; Gim Hee Lee, National University of SIngapore"
2650,Oral,Wasserstein Introspective Neural Networks,https://github.com/kjunelee/WINN,"Kwonjoon Lee, UC San Diego; Weijian Xu, UC San Diego; Fan Fan, UC San Diego; Zhuowen Tu, UCSD, USA"
2672,Spotlight,Person Transfer GAN to Bridge Domain Gap for Person Re-Identification,https://github.com/JoinWei-PKU/PTGAN,"Longhui Wei, Peking University; Shiliang Zhang, Peking University; Wen Gao, ; Qi Tian,"
420,Poster,Learning Pixel-level Semantic Affinity with Image-level Supervision for Weakly Supervised Semantic Segmentation,https://github.com/jiwoon-ahn/psa,"Jiwoon Ahn, DGIST; Suha Kwak, POSTECH"
2959,Poster,Pyramid Stereo Matching Network,https://github.com/JiaRenChang/PSMNet,"Jia-Ren Chang, National Chiao Tung University; Yong-Sheng Chen, National Chiao Tung University"
1699,Poster,FOTS: Fast Oriented Text Spotting with a Unified Network,https://github.com/jiangxiluning/FOTS.PyTorch,"Xuebo Liu, SenseTime Group Ltd.; Ding Liang, Sensetime; Shi Yan, SenseTime; Dagui Chen, SenseTime; Yu Qiao, Shenzhen Institutes of Advanced Technology, Chinese Academy of Sciences; Junjie Yan,"
475,Poster,Towards Faster Training of Global Covariance Pooling Networks by Iterative Matrix Square Root Normalization,https://github.com/jiangtaoxie/fast-MPN-COV,"Peihua Li, ; Jiangtao Xie, ; Qilong Wang, ; Zilin Gao, Dalian University of Technology"
1724,Oral,Convolutional Neural Networks with Alternately Updated Clique,https://github.com/iboing/CliqueNet,"Yibo Yang, Peking Univ.; Zhisheng Zhong, ; Tiancheng Shen, ; Zhouchen Lin, Peking University, China"
1287,Oral,Squeeze-and-Excitation Networks,https://github.com/hujie-frank/SENet,"Jie Hu, Momenta; Li Shen, University of Oxford; Gang Sun, Momenta"
48,Poster,Density-aware Single Image De-raining using a Multi-stream Dense Network,https://github.com/hezhangsprinter/DID-MDN,"He Zhang, Rutgers; Vishal Patel,"
49,Poster,Densely Connected Pyramid Dehazing Network,https://github.com/hezhangsprinter/DCPDN,"He Zhang, Rutgers; Vishal Patel,"
3409,Poster,Efficient Interactive Annotation of Segmentation Datasets with Polygon-RNN++,https://github.com/fidler-lab/polyrnn-pp-pytorch,"David Acuna, University of Toronto; Huan Ling, UofT; Amlan Kar, University of Toronto; Sanja Fidler,"
1645,Poster,LiDAR-Video Driving Dataset: Learning Driving Policies Effectively,https://github.com/driving-behavior/DBNet,"Yiping Chen, Xiamen University; Jingkang Wang, Shanghai Jiao Tong University; Cewu Lu, Shanghai Jiao Tong University; Zhipeng Luo, Xiamen University; Jonathan Li, University of Waterloo; Han Xue, Shanghai Jiao Tong University; Cheng Wang, Xiamen University"
431,Poster,Learning to Compare: Relation Network for Few-Shot Learning,https://github.com/dragen1860/LearningToCompare-Pytorch,"Flood Sung, Independent Researcher; Yongxin Yang, Queen Mary University of London; Li Zhang, Queen Mary University of London; Tao Xiang, Queen Mary University of London; Phil Torr, Oxford; Timothy Hospedales, University of Edinburgh"
458,Spotlight,Iterative Visual Reasoning Beyond Convolutions,https://github.com/coderSkyChen/Iterative-Visual-Reasoning.pytorch,"Xinlei Chen, Facebook; Li-jia Li, Google Inc; Fei-Fei Li, Google Inc.; Abhinav Gupta,"
2114,Poster,Structure Inference Net: Object Detection Using Scene-Level Context and Instance-Level Relationships,https://github.com/choasup/SIN,"Yong Liu, ICT; Ruiping Wang, Institute of Computing Technology, Chinese Academy of Sciences; Shiguang Shan, Chinese Academy of Sciences; Xilin Chen,"
1584,Spotlight,PlaneNet: Piece-wise Planar Reconstruction from a Single RGB Image,https://github.com/art-programmer/PlaneNet,"Chen Liu, WUSTL; Jimei Yang, ; Duygu Ceylan, ; Ersin Yumer, Argo AI; Yasutaka Furukawa,"
3606,Poster,Deep Back-Projection Networks For Super-Resolution,https://github.com/alterzero/DBPN-Pytorch,"Muhammad Haris, Toyota Technological Institute; Greg Shakhnarovich, ; Norimichi Ukita, NAIST"
1328,Spotlight,Tell Me Where To Look: Guided Attention Inference Network,https://github.com/alokwhitewolf/Guided-Attention-Inference-Network,"Kunpeng Li, Northeastern University; Ziyan Wu, Siemens Corporation; Kuan-Chuan Peng, Siemens Corporation; Jan Ernst, Siemens Corporation; Yun Fu, Northeastern University"
779,Poster,Unsupervised Cross-dataset Person Re-identification by Transfer Learning of Spatio-temporal Patterns,https://github.com/ahangchen/Tfusion,"Jianming Lv, South China University of Technology; Weihang Chen, South China University of Technology; Qing Li, City University of Hong Kong; Can Yang, South China University of Technology"
12,Oral,DensePose: Multi-Person Dense Human Pose Estimation In The Wild,,"Alp Guler, INRIA; Natalia Neverova, Facebook AI Research; Iasonas Kokkinos, FAIR/UCL"
27,Spotlight,Shape from Shading through Shape Evolution,,"Dawei Yang, University of Michigan; Jia Deng,"
37,Spotlight,End-to-End Dense Video Captioning with Masked Transformer,,"Luowei Zhou, University of Michigan; Yingbo Zhou, Salesforce; Jason Corso, ; Richard Socher, Meta-Mind; Caiming Xiong, Salesforce"
53,Spotlight,TieNet: Text-Image Embedding Network for Common Thorax Disease Classification and Reporting in Chest X-rays,,"Xiaosong Wang, NIH; Yifan Peng, NIH NLM; Le Lu, Nvidia Corp; Zhiyong Lu, ; Ronald Summers,"
76,Oral,Context Encoding for Semantic Segmentation,,"Hang Zhang, Rutgers University; Kristin Dana, ; Jianping Shi, SenseTime; Zhongyue Zhang, Amazon; Xiaogang Wang, Chinese University of Hong Kong; Ambrish Tyagi, Amazon; Amit Agrawal, Amazon"
103,Spotlight,"Real-World Repetition Estimation by Div, Grad and Curl",,"Tom Runia, University of Amsterdam; Cees Snoek, University of Amsterdam; Arnold Smeulders, University of Amsterdam, Netherlands"
110,Spotlight,Learning Intrinsic Image Decomposition from Watching the World,,"Zhengqi Li, Cornell University; Noah Snavely, Cornell University / Google"
128,Oral,Augmented Skeleton Space Transfer for Depth-based Hand Pose Estimation,,"Seungryul Baek, Imperial College London; Kwang In Kim, University of Bath; Tae-Kyun Kim, Imperial College London"
142,Spotlight,Multi-view Harmonized Bilinear Network for 3D Object Recognition,,"Tan Yu, Nanyang Technological Univ; Jingjing Meng, ; Junsong Yuan, Nanyang Technological University"
144,Spotlight,Tangent Convolutions for Dense Prediction in 3D,,"Maxim Tatarchenko, Freiburg; Jaesik Park, Intel Labs; Qian-Yi Zhou, ABQ Technologies; Vladlen Koltun, Intel Labs"
145,Oral,Semi-parametric Image Synthesis,,"Xiaojuan Qi, CUHK; Qifeng Chen, Intel Labs; Jiaya Jia, Chinese University of Hong Kong; Vladlen Koltun, Intel Labs"
155,Spotlight,3D Hand Pose Estimation: From Current Achievements to Future Goals,,"Shanxin Yuan, Imperial College London; Guillermo Garcia-Hernando, Imperial College London; Bjorn Stenger, ; Tae-Kyun Kim, Imperial College London; Gyeongsik Moon, Seoul National University; Ju Yong Chang, Kwangwoon University; Kyoung Mu Lee, ; Pavlo Molchanov, NVIDIA Research; Liuhao Ge, NTU; Junsong Yuan, Nanyang Technological University; Xinghao Chen, Tsinghua University; Guijin Wang, Tsinghua University; Fan Yang, Nara institute of science and technology; Kai Akiyama, Nara Institute of Science and Technology; Yang Wu, Nara Institute of Science and Technology; Qingfu Wan, Fudan University; Meysam Madadi, Autonomus University of Barcelona and Computer Vision Center, Barcelona, Spain; Sergio Escalera, University of Barcelona; Shile Li, Technical University of Munich; Dongheui Lee, Technical University of Munich; Iason Oikonomidis, FORTH; Antonis Argyros, FORTH"
167,Spotlight,BlockDrop: Dynamic Inference Paths in Residual Networks,,"Zuxuan Wu, University of Maryland; Tushar Nagarajan, University of Texas at Austin; Abhishek Kumar, ; Steven Rennie, ; Larry Davis, University of Maryland, USA; Kristen Grauman, ; Rogerio Feris, IBM"
181,Oral,Practical Block-wise Neural Network Architecture Generation,,"Zhao Zhong, Institute of Automation,CAS; Junjie Yan, ; Wei Wu, ; Jing Shao, The Sensetime Group Limited; cheng-lin Liu,"
185,Oral,Are You Talking to Me? Reasoned Visual Dialog Generation through Adversarial Learning,,"Qi Wu, University of Adelaide; Peng Wang, ; Chunhua Shen, University of Adelaide; Ian Reid, ; Anton Van den Hengel, University of Adelaide"
203,Spotlight,Nonlinear 3D Face Morphable Model,,"LUAN TRAN, Michigan State University; Xiaoming Liu, Michigan State University"
205,Spotlight,Neural Baby Talk,,"Jiasen Lu, Georgia Institute of Technology; Jianwei Yang, Georgia Tech; Dhruv Batra, Georgia Tech; Devi Parikh, Georgia Tech"
242,Spotlight,Few-Shot Image Recognition by Predicting Parameters from Activations,,"Siyuan Qiao, Johns Hopkins University; Chenxi Liu, JHU; Wei Shen, Shanghai University; Alan Yuille,"
270,Oral,Illuminant Spectra-based Source Separation Using Flash Photography,,"Zhuo Hui, Carnegie Mellon University; Kalyan Sunkavalli, Adobe Systems Inc.; Sunil Hadap, ; Aswin Sankaranarayanan, Carnegie Mellon University"
281,Spotlight,Tracking Multiple Objects Outside the Line of Sight using Speckle Imaging,,"Brandon Smith, University of Wisconsin-Madiso; Matthew O'Toole, Stanford University; Mohit Gupta, Wisconsin"
298,Spotlight,Audio to Body Dynamics,,"Eli Shlizerman, Facebook; Lucio Dery, Stanford; Hayden Schoen, Facebook; Ira Kemelmacher,"
325,Spotlight,Super SloMo: High Quality Estimation of Multiple Intermediate Frames for Video Interpolation,,"Huaizu Jiang, UMass Amherst; Deqing Sun, NVIDIA; Varun Jampani, NVIDIA Research; Ming-Hsuan Yang, UC Merced; Erik Miller, ; Jan Kautz, NVIDIA"
350,Spotlight,Deep Adversarial Metric Learning,,"Yueqi Duan, Tsinghua University; Wenzhao Zheng, Tsinghua University; Xudong Lin, Tsinghua University; Jiwen Lu, Tsinghua University; Jie Zhou,"
369,Oral,"Total Capture: A 3D Deformation Model for Tracking Faces, Hands, and Bodies",,"Hanbyul Joo, CMU; Tomas Simon, Oculus Research; Yaser Sheikh,"
374,Spotlight,Consensus Maximization for Semantic Region Correspondences,,"Pablo Speciale, ETH; Danda Paudel, ; Martin Oswald, ETH Zurich; Hayko Riemenschneider, Computer Vision Lab, ETH Zurich; Luc Van Gool, KTH; Marc Pollefeys, ETH"
405,Spotlight,"Look, Imagine and Match: Improving Textual-Visual Cross-Modal Retrieval with Generative Models",,"Jiuxiang Gu, Nanyang Technological Universi; Jianfei Cai, ; Joty Shafiq Rayhan, ; Li Niu, Rice University; Gang Wang,"
406,Spotlight,VITON: An Image-based Virtual Try-on Network,,"Xintong Han, University of Maryland; Zuxuan Wu, University of Maryland; Zhe Wu, University of Maryland; Ruichi Yu, ; Larry Davis, University of Maryland, USA"
423,Spotlight,Fast and Accurate Online Video Object Segmentation via Tracking Parts,,"Jingchun Cheng, Tsinghua University; Yi-Hsuan Tsai, NEC Labs America; Wei-Chih Hung, University of California, Merced; Shengjin Wang, ; Ming-Hsuan Yang, UC Merced"
435,Oral,Deep Layer Aggregation,,"Fisher Yu, UC Berkeley; Dequan Wang, UC Berkeley; Evan Shelhamer, UC Berkeley; Trevor Darrell, UC Berkeley, USA"
442,Spotlight,M3: Multimodal Memory Modelling for Video Captioning,,"Junbo Wang, Institute of Automation, Chine; Wei Wang, ; Yan Huang, ; Liang Wang, unknown; Tieniu Tan, NLPR China"
465,Spotlight,Textbook Question Answering under Teacher Guidance with Memory Networks,,"Juzheng Li, Tsinghua University; Hang Su, Tsinghua University; Jun Zhu, Tsinghua University; Siyu Wang, ; Bo Zhang,"
471,Spotlight,Functional Map of the World,,"Gordon Christie, JHU/APL; Neil Fendley, JHU/APL; James Wilson, DigitalGlobe; Ryan Mukherjee, JHU/APL"
483,Oral,Left-Right Comparative Recurrent Model for Stereo Matching,,"Zequn Jie, ; Pengfei Wang, NUS; Yonggen Ling, Tencent; Bo Zhao, ; Jiashi Feng, ; Wei Liu,"
487,Oral,Analytic Expressions for Probabilistic Moments of PL-DNN with Gaussian Input,,"Adel Bibi, KAUST; Modar Alfadly, King Abdullah University of Science and Technology; Bernard Ghanem,"
488,Spotlight,Zero-Shot Sketch-Image Hashing,,"Yuming Shen, University of East Anglia; Li Liu, University of East Anglia; Fumin Shen, ; Ling Shao, University of East Anglia"
490,Spotlight,Interpretable Convolutional Neural Networks,,"Quanshi Zhang, UCLA; Yingnian Wu, ; Song-Chun Zhu,"
500,Spotlight,Generating Synthetic X-ray Images of a Person from the Surface Geometry,,"Brian Teixeira, Siemens Healthineers; Vivek Singh, Siemens Healthineers; Kai Ma, Siemens Healthineers; Birgi Tamersoy, Siemens Healthineers; Terrence Chen, Siemens Healthineers; Yifan Wu, Temple University ; Elena Balashova, Princeton University; Dorin Comaniciu, Siemens Healthineers"
533,Spotlight,Recurrent Pixel Embedding for Instance Grouping,,"Shu Kong, University of California, Irvine; Charless Fowlkes, University of California, Irvine, USA"
552,Oral,An Analysis of Scale Invariance in Object Detection - SNIP,,"Bharat Singh, ; Larry Davis, University of Maryland, USA"
565,Oral,Finding Tiny Faces in the Wild with Generative Adversarial Network,,"Yancheng Bai, Kaust/Iscas; Yongqiang Zhang, Harbin institute of Technology/KAUST; Mingli Ding, ; Bernard Ghanem,"
567,Spotlight,SSNet: Scale Selection Network for Online 3D Action Prediction,,"Jun Liu, Nanyang Technological University; Amir Shahroudy, NTU Singapore; Gang Wang, ; Ling-Yu Duan, ; Alex Kot,"
568,Spotlight,Integrated facial landmark localization and super-resolution of real-world very low resolution faces in arbitrary poses with GANs,,"Adrian Bulat, ; Georgios Tzimiropoulos,"
581,Spotlight,Deep Cross-media Knowledge Transfer,,"Xin Huang, Peking University; Yuxin Peng, Peking University"
601,Spotlight,NISP: Pruning Networks using Neuron Importance Score Propagation,,"Ruichi Yu, ; Ang Li, Google DeepMind; Chun-Fu (Richard) Chen, IBM T.J. Watson Research Cente; Jui-Hsin Lai, ; Vlad Morariu, University of Maryland; Xintong Han, University of Maryland; Mingfei Gao, University of Maryland; Ching-Yung Lin, ; Larry Davis, University of Maryland, USA"
630,Spotlight,Learning a Toolchain for Image Restoration,,"Ke Yu, CUHK; Chao Dong, Sensetime Co. Ltd ; Chen-Change Loy, the Chinese University of Hong Kong"
668,Spotlight,Fine-grained Video Captioning for Sports Narrative,,"Huanyu Yu, Shanghai Jiao Tong University; Shuo Cheng, SJTU; Bingbing Ni, ; Minsi Wang, Shanghai Jiao Tong University; Zhang Jian, Shanghai Jiao Tong University; Xiaokang Yang,"
687,Spotlight,Hand PointNet: 3D Hand Pose Estimation using Point Sets,,"Liuhao Ge, NTU; Junwu Weng, Nanyang Technological Univ.; Yujun Cai, NTU; Junsong Yuan, Nanyang Technological University"
732,Spotlight,Visual Question Reasoning on General Dependency Tree,,"Qingxing Cao, Sun Yat-Sen University; Xiaodan Liang, Carnegie Mellon University; Bailin Li, SUN-YAT SEN UNIVERSITY; Liang Lin,"
736,Spotlight,GANerated Hands for Real-Time 3D Hand Tracking from Monocular RGB,,"Franziska Mueller, MPI Informatics; Florian Bernard, MPI Informatics; Oleksandr Sotnychenko, MPI Informatics; Dushyant Mehta, MPI For Informatics; Srinath Sridhar, ; Dan Casas, MPI; Christian Theobalt, MPI Informatics"
747,Spotlight,Embodied Real-World Active Perception,,"Fei Xia, Stanford University; Amir Zamir, Stanford, UC Berkeley; Zhi-Yang He, Stanford University; Alexander Sax, Stanford University; Jitendra Malik, ; Silvio Savarese,"
754,Spotlight,"SfSNet : Learning Shape, Reflectance and Illuminance of Faces `in the wild'",,"Soumyadip Sengupta, University of Maryland; Angjoo Kanazawa, University of Maryland; Carlos Castillo, ; David Jacobs, University of Maryland"
765,Spotlight,What Makes a Video a Video: Analyzing Temporal Information in Video Understanding Models and Datasets,,"De-An Huang, Stanford University; Vignesh Ramanathan, Facebook; Dhruv Mahajan, ; Juan Carlos Niebles, Stanford University; Fei-Fei Li, Stanford University; Lorenzo Torresani, Darthmout College, USA; Manohar Paluri,"
777,Spotlight,Quantization and Training of Neural Networks for Efficient Integer-Arithmetic-Only Inference,,"Benoit Jacob, Google; Skirmantas Kligys, Google; Bo Chen, Google; Matthew Tang, Google; Menglong Zhu, ; Andrew Howard, Google; Dmitry Kalenichenko, Google; Hartwig Adam, Google"
778,Oral,"Finding It"": Weakly-Supervised Reference-Aware Visual Grounding in Instructional Video""",,"De-An Huang, Stanford University; Shyamal Buch, Stanford University; Lucio Dery, Stanford University; Animesh Garg, Stanford University; Fei-Fei Li, Stanford University; Juan Carlos Niebles, Stanford University"
809,Spotlight,CVM-Net: Cross-View Matching Network for Image-Based Ground-to-Aerial Geo-Localization,,"Sixing Hu, NUS; Mengdan Feng, NUS; Rang Nguyen, National Uni. of Singapore; Gim Hee Lee, National University of SIngapore"
811,Spotlight,Visual Question Generation as Dual Task of Visual Question Answering,,"Yikang Li, ; Nan Duan, Microsoft; Bolei Zhou, Massachuate Institute of Technology; Xiao Chu, Baidu; Wanli Ouyang, The University of Sydney; Xiaogang Wang, Chinese University of Hong Kong"
812,Spotlight,Revisiting Dilated Convolution: A Simple Approach for Weakly- and Semi- Supervised Semantic Segmentation,,"Yunchao Wei, ; Huaxin Xiao, ; Honghui Shi, UIUC; Zequn Jie, ; Jiashi Feng, ; Thomas Huang,"
836,Spotlight,MegDet: A Large Mini-Batch Object Detector,,"Chao Peng, Megvii; Tete Xiao, Peking University; Zeming Li, Tsinghua University, Megvii; Yuning Jiang, Megvii inc.; Xiangyu Zhang, Megvii Inc; Kai Jia, Mevii; Gang Yu, Face++; Jian Sun,"
844,Spotlight,TOM-Net: Learning Transparent Object Matting from a Single Image,,"Guanying Chen, The University of Hong Kong; Kai Han, ; Kwan-Yee Kenneth Wong, The University of Hong Kong"
853,Spotlight,Benchmarking 6DOF Outdoor Visual Localization in Changing Conditions,,"Torsten Sattler, ETH Zurich; Will Maddern, University of Oxford; Carl Toft, Chalmers University ; Akihiko Torii, Tokyo Institute of Technology; Lars Hammarstrand, Chalmers university of technol; Erik Stenborg, Chalmers University of Tech.; Daniel Safari, DTU; Marc Pollefeys, ETH; Josef Sivic, ; Fredrik Kahl, Chalmers; Tomas Pajdla,"
878,Spotlight,Learning to Detect Features in Texture Images,,"Linguang Zhang, Princeton University; Szymon Rusinkiewicz, Princeton University"
906,Spotlight,Label Denoising Adversarial Network (LDAN) for Inverse Lighting of Face Images,,"Hao Zhou, UMD; Jin Sun, University of Maryland; Yaser Yacoob, Univ of Maryland; David Jacobs, University of Maryland"
909,Spotlight,Unsupervised Deep Generative Adversarial Hashing Network,,"Kamran Ghasedi Dizaji, University of Pittsburgh; Feng Zheng, University of Pittsburgh; Najmeh Sadoughi, University of Texas at Dallas; Heng Huang, University of Pittsburgh"
914,Spotlight,LSTM stack-based Neural Multi-sequence Alignment TeCHnique (NeuMATCH),,"Pelin Dogan, ETH Zurich; Albert Li, Disney Research; Leonid Sigal, University of British Columbia; Markus Gross,"
